{
  "apiVersion": "syntara.io/v1alpha1",
  "kind": "CatalogIndex",
  "metadata": {
    "sourceId": "local-quay",
    "generation": 42,
    "issuedAt": "2026-10-06T12:00:00Z",
    "expiresAt": "2026-10-13T12:00:00Z",
    "previousIndexDigest": "sha256:aaaaaaaaaaaaaaaaaaaaaaaaaaaaaaaaaaaaaaaaaaaaaaaaaaaaaaaaaaaaaaaa"
  },
  "spec": {
    "contractVersion": "syntara.io/v1alpha1",
    "entries": [
      {"namespace": "syntara", "name": "plugin-01", "version": "1.0.0", "artifactRepository": "syntara/plugins/plugin-01", "artifactDigest": "sha256:0101010101010101010101010101010101010101010101010101010101010101", "documentationDigest": "sha256:a101010101010101010101010101010101010101010101010101010101010101", "runtimeOwnership": "platform-runner"},
      {"namespace": "syntara", "name": "plugin-02", "version": "1.0.0", "artifactRepository": "syntara/plugins/plugin-02", "artifactDigest": "sha256:0202020202020202020202020202020202020202020202020202020202020202", "documentationDigest": "sha256:a202020202020202020202020202020202020202020202020202020202020202", "runtimeOwnership": "platform-runner"},
      {"namespace": "syntara", "name": "plugin-03", "version": "1.0.0", "artifactRepository": "syntara/plugins/plugin-03", "artifactDigest": "sha256:0303030303030303030303030303030303030303030303030303030303030303", "documentationDigest": "sha256:a303030303030303030303030303030303030303030303030303030303030303", "runtimeOwnership": "custom-workload"},
      {"namespace": "syntara", "name": "plugin-04", "version": "1.0.0", "artifactRepository": "syntara/plugins/plugin-04", "artifactDigest": "sha256:0404040404040404040404040404040404040404040404040404040404040404", "documentationDigest": "sha256:a404040404040404040404040404040404040404040404040404040404040404", "runtimeOwnership": "platform-runner"},
      {"namespace": "syntara", "name": "plugin-05", "version": "1.0.0", "artifactRepository": "syntara/plugins/plugin-05", "artifactDigest": "sha256:0505050505050505050505050505050505050505050505050505050505050505", "documentationDigest": "sha256:a505050505050505050505050505050505050505050505050505050505050505", "runtimeOwnership": "platform-runner"},
      {"namespace": "syntara", "name": "plugin-06", "version": "1.0.0", "artifactRepository": "syntara/plugins/plugin-06", "artifactDigest": "sha256:0606060606060606060606060606060606060606060606060606060606060606", "documentationDigest": "sha256:a606060606060606060606060606060606060606060606060606060606060606", "runtimeOwnership": "custom-workload"},
      {"namespace": "syntara", "name": "plugin-07", "version": "1.0.0", "artifactRepository": "syntara/plugins/plugin-07", "artifactDigest": "sha256:0707070707070707070707070707070707070707070707070707070707070707", "documentationDigest": "sha256:a707070707070707070707070707070707070707070707070707070707070707", "runtimeOwnership": "platform-runner"},
      {"namespace": "syntara", "name": "plugin-08", "version": "1.0.0", "artifactRepository": "syntara/plugins/plugin-08", "artifactDigest": "sha256:0808080808080808080808080808080808080808080808080808080808080808", "documentationDigest": "sha256:a808080808080808080808080808080808080808080808080808080808080808", "runtimeOwnership": "platform-runner"},
      {"namespace": "syntara", "name": "plugin-09", "version": "1.0.0", "artifactRepository": "syntara/plugins/plugin-09", "artifactDigest": "sha256:0909090909090909090909090909090909090909090909090909090909090909", "documentationDigest": "sha256:a909090909090909090909090909090909090909090909090909090909090909", "runtimeOwnership": "custom-workload"},
      {"namespace": "syntara", "name": "plugin-10", "version": "1.0.0", "artifactRepository": "syntara/plugins/plugin-10", "artifactDigest": "sha256:1010101010101010101010101010101010101010101010101010101010101010", "documentationDigest": "sha256:b101010101010101010101010101010101010101010101010101010101010101", "runtimeOwnership": "platform-runner"},
      {"namespace": "syntara", "name": "plugin-11", "version": "1.0.0", "artifactRepository": "syntara/plugins/plugin-11", "artifactDigest": "sha256:1111111111111111111111111111111111111111111111111111111111111111", "documentationDigest": "sha256:b111111111111111111111111111111111111111111111111111111111111111", "runtimeOwnership": "platform-runner"},
      {"namespace": "syntara", "name": "plugin-12", "version": "1.0.0", "artifactRepository": "syntara/plugins/plugin-12", "artifactDigest": "sha256:1212121212121212121212121212121212121212121212121212121212121212", "documentationDigest": "sha256:b212121212121212121212121212121212121212121212121212121212121212", "runtimeOwnership": "custom-workload"},
      {"namespace": "syntara", "name": "plugin-13", "version": "1.0.0", "artifactRepository": "syntara/plugins/plugin-13", "artifactDigest": "sha256:1313131313131313131313131313131313131313131313131313131313131313", "documentationDigest": "sha256:b313131313131313131313131313131313131313131313131313131313131313", "runtimeOwnership": "platform-runner"},
      {"namespace": "syntara", "name": "plugin-14", "version": "1.0.0", "artifactRepository": "syntara/plugins/plugin-14", "artifactDigest": "sha256:1414141414141414141414141414141414141414141414141414141414141414", "documentationDigest": "sha256:b414141414141414141414141414141414141414141414141414141414141414", "runtimeOwnership": "platform-runner"},
      {"namespace": "syntara", "name": "plugin-15", "version": "1.0.0", "artifactRepository": "syntara/plugins/plugin-15", "artifactDigest": "sha256:1515151515151515151515151515151515151515151515151515151515151515", "documentationDigest": "sha256:b515151515151515151515151515151515151515151515151515151515151515", "runtimeOwnership": "custom-workload"},
      {"namespace": "syntara", "name": "plugin-16", "version": "1.0.0", "artifactRepository": "syntara/plugins/plugin-16", "artifactDigest": "sha256:1616161616161616161616161616161616161616161616161616161616161616", "documentationDigest": "sha256:b616161616161616161616161616161616161616161616161616161616161616", "runtimeOwnership": "platform-runner"},
      {"namespace": "syntara", "name": "plugin-17", "version": "1.0.0", "artifactRepository": "syntara/plugins/plugin-17", "artifactDigest": "sha256:1717171717171717171717171717171717171717171717171717171717171717", "documentationDigest": "sha256:b717171717171717171717171717171717171717171717171717171717171717", "runtimeOwnership": "platform-runner"},
      {"namespace": "syntara", "name": "plugin-18", "version": "1.0.0", "artifactRepository": "syntara/plugins/plugin-18", "artifactDigest": "sha256:1818181818181818181818181818181818181818181818181818181818181818", "documentationDigest": "sha256:b818181818181818181818181818181818181818181818181818181818181818", "runtimeOwnership": "custom-workload"},
      {"namespace": "syntara", "name": "plugin-19", "version": "1.0.0", "artifactRepository": "syntara/plugins/plugin-19", "artifactDigest": "sha256:1919191919191919191919191919191919191919191919191919191919191919", "documentationDigest": "sha256:b919191919191919191919191919191919191919191919191919191919191919", "runtimeOwnership": "platform-runner"},
      {"namespace": "syntara", "name": "plugin-20", "version": "1.0.0", "artifactRepository": "syntara/plugins/plugin-20", "artifactDigest": "sha256:2020202020202020202020202020202020202020202020202020202020202020", "documentationDigest": "sha256:c202020202020202020202020202020202020202020202020202020202020202", "runtimeOwnership": "platform-runner"}
    ]
  }
}
