{
  "apiVersion": "syntara.io/v1alpha1",
  "kind": "CatalogIndex",
  "metadata": {"sourceId": "local-quay", "generation": 43, "issuedAt": "2026-10-06T12:00:00Z", "expiresAt": "2026-10-13T12:00:00Z", "previousIndexDigest": "sha256:aaaaaaaaaaaaaaaaaaaaaaaaaaaaaaaaaaaaaaaaaaaaaaaaaaaaaaaaaaaaaaaa"},
  "spec": {"contractVersion": "syntara.io/v1alpha1", "entries": [{"namespace": "syntara", "name": "github", "version": "1.0.0", "artifactRepository": "syntara/plugins/github", "artifactDigest": "sha256:1111111111111111111111111111111111111111111111111111111111111111", "documentationDigest": "sha256:2222222222222222222222222222222222222222222222222222222222222222", "runtimeOwnership": "platform-runner"}, {"namespace": "syntara", "name": "github", "version": "1.0.0", "artifactRepository": "syntara/plugins/github", "artifactDigest": "sha256:3333333333333333333333333333333333333333333333333333333333333333", "documentationDigest": "sha256:4444444444444444444444444444444444444444444444444444444444444444", "runtimeOwnership": "platform-runner"}]}
}
